{"$schema":"https://json-schema.org/draft/2020-12/schema","type":"object","required":["entry_id","term","definition","state","hash","supersedes"],"properties":{"entry_id":{"type":"string"},"term":{"type":"string"},"definition":{"type":"string"},"state":{"enum":["SEMENTE","EM_PESQUISA","AGUARDA_FONTE","EM_REVISAO","CANONICA","SUPERADA_COM_RASTRO"]},"hash":{"type":"object"},"supersedes":{"type":["string","null"]}}}
